{
  "schemaVersion": "featureclip.evidence-receipt/v1",
  "collectionId": "featureclip-nodekit-present-p1",
  "manifest": {
    "path": "evidence/nodekit-present.manifest.json",
    "digestMode": "canonical-json-sha256",
    "sha256": "eb5ecc6c35e7c516358db272dddc26131e502c696d9edfa1e8a9287577c4e7f3",
    "schemaVersion": "featureclip.evidence-manifest/v1"
  },
  "projection": {
    "path": "proof/nodekit-present.evidence-index.json",
    "digestMode": "canonical-json-sha256",
    "sha256": "a0f56026987e1e3802a39f4736afa5aac7560b497dcee67416c0ed5cb492ab0b",
    "schemaVersion": "nodekit.evidence-index/v1",
    "changeId": "nodekit-factory-p1"
  },
  "checks": {
    "passed": true,
    "pathSafety": "passed",
    "duplicateIds": "none",
    "duplicatePaths": "none",
    "artifactsDeclared": 3,
    "artifactBytesVerified": 3,
    "metadataMatched": 3,
    "gitTracked": 3,
    "independentWorkflowReceipts": 0,
    "generatedIllustrations": 0
  },
  "artifacts": [
    {
      "id": "noderoom-hero-walkthrough",
      "path": "assets/feature-noderoom-hero.gif",
      "sha256": "b443e36ac89a215027104576eb29c8bc4b258660872a43775390b6ab0f6a1673",
      "bytes": 2843694,
      "mediaType": "image/gif",
      "dimensions": {
        "width": 720,
        "height": 405
      },
      "representation": "rendered-from-captured-product-ui",
      "captureEnvironment": "deployed-application",
      "artifactVerification": "repository-bytes",
      "workflowVerification": "unverified",
      "basis": [
        {
          "path": "README.md",
          "digestMode": "normalized-text-sha256",
          "sha256": "b2b9f0f4b1389ea9578c53040bec8941cad574aa2042510d58011ec6ea25f423"
        },
        {
          "path": "NODE-LOOPS.md",
          "digestMode": "normalized-text-sha256",
          "sha256": "e7b926d35dea7be0cdeb1592dd2f56b920b2d30ae8a170eda1e81c30375f03e9"
        },
        {
          "path": "walkthrough.noderoom.specs.mjs",
          "digestMode": "normalized-text-sha256",
          "sha256": "23a6068b0f83dcd090ad08a4779fcf6278aa78a5182d863b05a4e7b5a56d9426"
        }
      ],
      "metadataMatched": true
    },
    {
      "id": "room-os-v1-state-screenshot",
      "path": "assets/room-os-v1-state-json.png",
      "sha256": "44cef10aa164fb5491033bc596495b38d8a34ad63c2b53f466dfa18184bc48a8",
      "bytes": 178021,
      "mediaType": "image/png",
      "dimensions": {
        "width": 1280,
        "height": 897
      },
      "representation": "rendered-from-captured-product-ui",
      "captureEnvironment": "deployed-application",
      "artifactVerification": "repository-bytes",
      "workflowVerification": "unverified",
      "basis": [
        {
          "path": "README.md",
          "digestMode": "normalized-text-sha256",
          "sha256": "b2b9f0f4b1389ea9578c53040bec8941cad574aa2042510d58011ec6ea25f423"
        },
        {
          "path": "assets/room-os-v1-state.json",
          "digestMode": "normalized-text-sha256",
          "sha256": "9c23f7a0bd5593fec06fa5595c567812f4929f39946eed97bd1e99223a013fdd"
        },
        {
          "path": "walkthrough.roomos.mjs",
          "digestMode": "normalized-text-sha256",
          "sha256": "3f2b0e16daa2ce309e1e11d38e0a33ac90ee7a333a0b06c1831f8eec5663cbad"
        }
      ],
      "metadataMatched": true
    },
    {
      "id": "solo-founder-baseline-frame",
      "path": "public/wt/SoloFounder/00.png",
      "sha256": "382f000ab4fbc430138fde58b34f7905bbde99aaada1e06bfb5c7b1af2208e9f",
      "bytes": 675621,
      "mediaType": "image/png",
      "dimensions": {
        "width": 2560,
        "height": 1600
      },
      "representation": "captured-product-ui",
      "captureEnvironment": "local-fixture",
      "artifactVerification": "repository-bytes",
      "workflowVerification": "unverified",
      "basis": [
        {
          "path": "README.md",
          "digestMode": "normalized-text-sha256",
          "sha256": "b2b9f0f4b1389ea9578c53040bec8941cad574aa2042510d58011ec6ea25f423"
        },
        {
          "path": "NODE-LOOPS.md",
          "digestMode": "normalized-text-sha256",
          "sha256": "e7b926d35dea7be0cdeb1592dd2f56b920b2d30ae8a170eda1e81c30375f03e9"
        },
        {
          "path": "walkthrough.solo-founder.specs.mjs",
          "digestMode": "normalized-text-sha256",
          "sha256": "3725d99e55838e04803af7674e3365f1bd99f62ab168a55e95362f06ea1d8a85"
        }
      ],
      "metadataMatched": true
    }
  ],
  "claimBoundary": {
    "releaseReady": false,
    "productWorkflowProof": "not-certified",
    "statement": "This receipt certifies repository containment, Git tracking, media signatures, dimensions, byte sizes, digests, and explicit source-truth labels. It does not certify production freshness, depicted workflow correctness, judge quality, or release readiness unless an artifact separately references an independent receipt."
  }
}
